{
  "schemaVersion": 1,
  "taskId": "TASK-2026-001",
  "revision": 10,
  "status": "in_progress",
  "currentPhase": "Phase 10",
  "lastCheckpoint": "Phase 9 repository-level conformance pilots passed",
  "nextAction": "Complete release governance, maintenance, and final acceptance audit",
  "retryCounters": {
    "verification_repair": {
      "used": 2,
      "limit": 3
    },
    "contract_repair": {
      "used": 1,
      "limit": 2
    }
  },
  "artifactLedger": "tasks/ledgers/TASK-2026-001-artifacts.json",
  "decisionLedger": "tasks/ledgers/TASK-2026-001-decisions.json",
  "handoff": "tasks/handoffs/TASK-2026-001-latest.json"
}
